{
  "schemaVersion": 1,
  "id": "arab-camps",
  "title": {"ar": "أناشيد المخيمات الكشفية العربية", "en": "Arab Scout Jamboree Anthems"},
  "source": {
    "name": {"ar": "بوصلة الكشاف", "en": "Scouts Compass"},
    "pageUrl": "https://sites.google.com/view/scoutscompass/%D8%A8%D9%86%D9%83-%D8%A7%D9%84%D8%A3%D9%86%D8%A7%D8%B4%D9%8A%D8%AF/%D8%A3%D9%86%D8%A7%D8%B4%D9%8A%D8%AF-%D8%A7%D9%84%D9%85%D8%AE%D9%8A%D9%85%D8%A7%D8%AA-%D8%A7%D9%84%D9%83%D8%B4%D9%81%D9%8A%D8%A9-%D8%A7%D9%84%D8%B9%D8%B1%D8%A8%D9%8A%D8%A9?authuser=0"
  },
  "migration": {"status": "pending", "reviewedAt": "2026-07-19"},
  "items": [

  ]
}
